{
  "prompt": "Which instrument is this?",
  "audio": {
    "asset": "audio/instruments/oboe-a4.m4a",
    "durationMs": 4000,
    "license": "original-swoond",
    "description": "A single reedy, nasal woodwind note.",
    "maxPlays": 3
  },
  "options": [
    {
      "id": "a",
      "text": "Oboe"
    },
    {
      "id": "b",
      "text": "Clarinet"
    },
    {
      "id": "c",
      "text": "Flute"
    }
  ],
  "correctOptionId": "a",
  "explanation": {
    "correct": "The nasal, reedy tone is the oboe, the note orchestras tune to.",
    "incorrect": "Listen for the nasal, reedy edge: that is the oboe."
  },
  "listenFor": [
    "Nasal tone",
    "Double reed"
  ]
}
